{"$schema":"https://json-schema.org/draft/2020-12/schema","$id":"https://aifc.invalid/schemas/completeness-basis-auditor-implementation-binding-v1.schema.json","type":"object","additionalProperties":false,"required":["schema","binding_id","basis_profile_id","basis_profile_content_hash","implementation_path","implementation_git_blob_sha1","implementation_raw_sha256","binding_status","authority_status","binding_content_hash"],"properties":{"schema":{"const":"AIFC/completeness-basis-auditor-implementation-binding/v1"},"binding_id":{"type":"string","minLength":1},"basis_profile_id":{"type":"string","minLength":1},"basis_profile_content_hash":{"type":"string","pattern":"^[0-9a-f]{64}$"},"implementation_path":{"const":"reference/verifier/lineage_completeness_basis_authority_v1.py"},"implementation_git_blob_sha1":{"type":"string","pattern":"^[0-9a-f]{40}$"},"implementation_raw_sha256":{"type":"string","pattern":"^[0-9a-f]{64}$"},"binding_status":{"const":"CONFIRMED_DUAL_BOUND_CANDIDATE_EXECUTION_IDENTITY"},"authority_status":{"const":"NOT_ESTABLISHED"},"binding_content_hash":{"type":"string","pattern":"^[0-9a-f]{64}$"}}}
