{"schema":"AIFC/completeness-basis-auditor-implementation-binding/v1","binding_id":"AIFC-SAL-V1.13-COMPLETENESS-BASIS-AUDITOR-IMPLEMENTATION-BINDING-V1","basis_profile_id":"AIFC-SAL-V1.13-LINEAGE-COMPLETENESS-BASIS-PROFILE-V1","basis_profile_content_hash":"4b5a2921ebca347c35a890c3fcc5b8dfa949a8caca37101c6da1faf2c11e414e","implementation_path":"reference/verifier/lineage_completeness_basis_authority_v1.py","implementation_git_blob_sha1":"0d9f699c86ed26398b28eb2325f7434070c1f2f9","implementation_raw_sha256":"14df901e6667ec91cfebfc398a839d1f980502681702377c021075c3e1a597a8","binding_status":"CONFIRMED_DUAL_BOUND_CANDIDATE_EXECUTION_IDENTITY","authority_status":"NOT_ESTABLISHED","binding_content_hash":"e2675b8a5af351af9ad511c4ba30b30ea7b479e9d3278cc8fe3b6af0c21a9843"}
